{
  "$schema": "https://json-schema.org/draft/2020-12/schema",
  "$id": "https://eyelock.github.io/ynh/schema/cli/agent-run.schema.json",
  "title": "ynh agent run --format json",
  "description": "Final result of `ynh agent run --format json`. One object per run, emitted on every path \u2014 converged or not, because a run that did not converge is the one worth investigating. Distinct from `--emit-jsonl`, which is an event stream. Goes to stderr when `--emit-jsonl -` is streaming the trajectory to stdout, so NDJSON stays clean.",
  "x-capabilities": "0.9",
  "type": "object",
  "additionalProperties": false,
  "required": [
    "capabilities",
    "ynh_version",
    "exit_code",
    "converged",
    "budgets",
    "budget_sources",
    "consumed",
    "changed_files"
  ],
  "properties": {
    "capabilities": {
      "type": "string",
      "description": "Wire-protocol version. See CLAUDE.md capability-bump rule."
    },
    "ynh_version": {
      "type": "string",
      "description": "Binary release version or dev-build identifier."
    },
    "exit_code": {
      "type": "integer",
      "description": "Mirrors the process exit code, so a consumer reading this and a consumer branching on $? never disagree. 0 converged; 1 refused before any worker started (a resume refused is 21); 10 turn cap; 11 token budget; 12 wall clock; 13 stuck; 14 tamper \u2014 the baseline moved during the run; 15 plan-iteration cap; 20 worker error; 21 resume error; 22 gate error \u2014 `ynh check` could not run; 30 aborted by user; 31 interrupted."
    },
    "reason": {
      "type": "string",
      "description": "Why the run ended, when it was not a clean convergence."
    },
    "converged": {
      "type": "boolean",
      "description": "True only when the sensors agreed the work was done. Never true alongside a non-zero exit_code."
    },
    "session_id": {
      "type": "string"
    },
    "session_dir": {
      "type": "string",
      "description": "Directory holding the checkpoint, trajectory and any recorded gate-write attempts."
    },
    "worktree": {
      "type": "string",
      "description": "Directory the agent worked in and sensors ran against."
    },
    "backend": {
      "type": "string",
      "description": "Worker backend that drove the agent."
    },
    "model": {
      "type": "string",
      "description": "The model the worker reported it ran on, as the backend states it, with an alias resolved to its id (Claude Code: `sonnet` becomes `claude-sonnet-5-5`). Absent when the backend reported none (Codex reports none); never filled in from `model_requested`. After a resume, the latest worker process's."
    },
    "model_requested": {
      "type": "string",
      "description": "The model this run asked for with --model, as given. Absent when none was pinned and the backend chose its default. Not restored by --resume, as --model is not."
    },
    "auto_approve": {
      "type": "string",
      "enum": ["edits", "all"],
      "description": "The --auto-approve level the worker ran with. Absent means none: no permission flag was passed to the worker."
    },
    "effort": {
      "type": "string",
      "description": "The reasoning effort the worker reported it ran with, in the backend's own terms (Claude Code: low, medium, high, xhigh, max). Absent means the backend did not report one, not that none was in force. Never inferred from the model name, and never filled in from `effort_requested`."
    },
    "effort_requested": {
      "type": "string",
      "enum": ["low", "medium", "high"],
      "description": "The reasoning effort this run asked the worker for, from --effort or the harness's agent.effort. Absent when none was asked for. Compare with `effort`: a backend that applied another level shows as the two disagreeing. Not restored by --resume."
    },
    "harness": {
      "type": "object",
      "additionalProperties": false,
      "required": [
        "name"
      ],
      "description": "The harness the run was verified against. Absent when no harness was named \u2014 such a run is a plain agent runner and was never asked to verify itself.",
      "properties": {
        "name": {
          "type": "string"
        },
        "version": {
          "type": "string"
        },
        "sha": {
          "type": "string",
          "description": "Resolved commit the harness was installed from, recorded by `ynh install`. Version alone is an author-declared string that can be reused across different content; the SHA is what pins a run to one set of sensors."
        }
      }
    },
    "budgets": {
      "type": "object",
      "additionalProperties": false,
      "required": [
        "max_turns",
        "max_tokens",
        "max_wall_ms"
      ],
      "description": "The caps in force for this run.",
      "properties": {
        "max_turns": {
          "type": "integer"
        },
        "max_tokens": {
          "type": "integer"
        },
        "max_wall_ms": {
          "type": "integer"
        }
      }
    },
    "budget_sources": {
      "type": "object",
      "additionalProperties": false,
      "required": [
        "turns",
        "tokens",
        "wall"
      ],
      "description": "Where each cap came from. A cap nobody chose that fires is noise in a batch of runs; a cap that was chosen and fires is a finding. These must be distinguishable.",
      "properties": {
        "turns": {
          "type": "string",
          "enum": [
            "flag",
            "manifest",
            "default"
          ]
        },
        "tokens": {
          "type": "string",
          "enum": [
            "flag",
            "manifest",
            "default"
          ]
        },
        "wall": {
          "type": "string",
          "enum": [
            "flag",
            "manifest",
            "default"
          ]
        }
      }
    },
    "consumed": {
      "type": "object",
      "additionalProperties": false,
      "required": [
        "turns",
        "tokens",
        "wall_ms"
      ],
      "description": "What the run actually spent. Reported on failure as well as success.",
      "properties": {
        "turns": {
          "type": "integer"
        },
        "tokens": {
          "type": "integer",
          "description": "Input plus output tokens. Cache reads and cache writes are not included."
        },
        "input_tokens": {
          "type": "integer",
          "description": "Input tokens, summed over every turn including the plan phase. Absent when the backend reported no usage."
        },
        "output_tokens": {
          "type": "integer",
          "description": "Output tokens, summed like input_tokens. Absent when the backend reported no usage."
        },
        "cache_read_tokens": {
          "type": "integer",
          "description": "Tokens read from the prompt cache, not counted in tokens. Absent when the backend does not report a cache-read count."
        },
        "cache_creation_tokens": {
          "type": "integer",
          "description": "Tokens written to the prompt cache, summed per turn like cache_read_tokens and not counted in tokens. Their cost is already inside cost_usd. Absent when the backend does not report a cache-write count; zero only when it reported zero."
        },
        "cost_usd": {
          "type": "number",
          "minimum": 0,
          "description": "Cost in US dollars as the backend reported it, summed over the run. ynh never prices tokens itself. Absent when the backend reported no cost; zero only when it reported zero."
        },
        "wall_ms": {
          "type": "integer"
        },
        "plan_iterations": {
          "type": "integer"
        }
      }
    },
    "bound_by": {
      "type": "string",
      "enum": [
        "turns",
        "tokens",
        "wall_clock"
      ],
      "description": "Which cap ended the run. Absent when no cap bound it."
    },
    "convergence": {
      "type": "object",
      "additionalProperties": false,
      "required": [
        "sensor",
        "passed"
      ],
      "description": "The convergence verifiers' last word. `sensor`, `passed` and `summary` speak for the first verifier, by name, that did not pass, or for the first verifier when all passed. Absent means none was declared, which is different from one that ran and disagreed.",
      "properties": {
        "sensor": {
          "type": "string"
        },
        "passed": {
          "type": "boolean"
        },
        "summary": {
          "type": "string"
        },
        "verifiers": {
          "type": "array",
          "description": "Every convergence verifier, in name order. Optional.",
          "items": {
            "type": "object",
            "additionalProperties": false,
            "required": [
              "sensor",
              "status",
              "passed"
            ],
            "properties": {
              "sensor": {
                "type": "string"
              },
              "kind": {
                "type": "string",
                "description": "The sensor's kind. Absent when the verifiers' check could not run."
              },
              "status": {
                "type": "string",
                "description": "The verifier's `ynh check` status (`pass`, `fail`, `known`, `reported`, `deferred`), or `skipped` when it did not run. Open set."
              },
              "passed": {
                "type": "boolean",
                "description": "Whether this verifier let the run converge: it ran, reached a verdict, and did not gate."
              },
              "summary": {
                "type": "string"
              }
            }
          }
        }
      }
    },
    "sensors": {
      "type": "array",
      "description": "The final gate result \u2014 the evidence behind `converged`. Same per-sensor shape as `ynh check --format json`.",
      "items": {
        "type": "object"
      }
    },
    "changed_files": {
      "type": "array",
      "description": "Paths the run modified relative to base_commit, including new files. A converged run that changed nothing, and a run that rewrote forty files nobody asked about, are both findings.",
      "items": {
        "type": "string"
      }
    },
    "base_commit": {
      "type": "string",
      "description": "Commit the work started from."
    },
    "image_digest": {
      "type": "string",
      "description": "Digest of the container image this run executed in, from the YNH_IMAGE_DIGEST environment variable. A run cannot observe this for itself \u2014 a digest is computed after a build, and a process inside a container has no portable way to learn its own image \u2014 so the launcher passes it in. Absent means not recorded, not uncontainerised."
    }
  }
}
